SUBJECT_ID,HADM_ID,SEQ_NUM,ICD9_CODE,SHORT_TITLE,LONG_TITLE,ICUSTAY_ID,HCUP_CCS_2015,USE_IN_BENCHMARK
268,110404,1,48241,Meth sus pneum d/t Staph,Methicillin susceptible pneumonia due to Staphylococcus aureus,280836,Pneumonia (except that caused by tuberculosis or sexually transmitted disease),1
268,110404,2,4280,CHF NOS,"Congestive heart failure, unspecified",280836,Congestive heart failure; nonhypertensive,1
268,110404,3,51881,Acute respiratry failure,Acute respiratory failure,280836,Respiratory failure; insufficiency; arrest (adult),1
268,110404,4,5845,"Ac kidny fail, tubr necr",Acute kidney failure with lesion of tubular necrosis,280836,Acute and unspecified renal failure,1
268,110404,5,4275,Cardiac arrest,Cardiac arrest,280836,Cardiac arrest and ventricular fibrillation,0
268,110404,6,0389,Septicemia NOS,Unspecified septicemia,280836,Septicemia (except in labor),1
268,110404,7,49322,Ch obst asth w (ac) exac,Chronic obstructive asthma with (acute) exacerbation,280836,Asthma,0
268,110404,8,2761,Hyposmolality,Hyposmolality and/or hyponatremia,280836,Fluid and electrolyte disorders,1
268,110404,9,4271,Parox ventric tachycard,Paroxysmal ventricular tachycardia,280836,Cardiac dysrhythmias,1
