SUBJECT_ID,HADM_ID,SEQ_NUM,ICD9_CODE,SHORT_TITLE,LONG_TITLE,ICUSTAY_ID,HCUP_CCS_2015,USE_IN_BENCHMARK
178,196159,1,55321,Incisional hernia,Incisional hernia without mention of obstruction or gangrene,297704,Abdominal hernia,0
178,196159,2,99812,Hematoma complic proc,Hematoma complicating a procedure,297704,Complications of surgical procedures or medical care,1
178,196159,3,2851,Ac posthemorrhag anemia,Acute posthemorrhagic anemia,297704,Acute posthemorrhagic anemia,0
178,196159,4,E8788,Abn react-surg proc NEC,"Other specified surgical operations and procedures causing abnormal patient reaction, or later complication, without mention of misadventure at time of operation",297704,Adverse effects of medical care,0
178,196159,5,5569,Ulceratve colitis unspcf,"Ulcerative colitis, unspecified",297704,Regional enteritis and ulcerative colitis,0
178,196159,6,42731,Atrial fibrillation,Atrial fibrillation,297704,Cardiac dysrhythmias,1
178,196159,7,3949,Mitral valve dis NEC/NOS,Other and unspecified mitral valve diseases,297704,Heart valve disorders,0
178,196159,8,4019,Hypertension NOS,Unspecified essential hypertension,297704,Essential hypertension,1
178,196159,9,V4501,Status cardiac pacemaker,Cardiac pacemaker in situ,297704,Conduction disorders,1
